{
  "bundle_id": "8bd79457-b071-4b84-b909-d3eac9626654",
  "run_at": "2026-09-06T14:40:21.490586+00:00",
  "trigger": "on_commit",
  "inventory_id": "696ff53e-77d1-490c-864a-e2f375549041",
  "runner_version": "0.1.0",
  "control_pack": {
    "path": "controls",
    "sha256": "e7f697cc8983a7b572c3882afeb122e97625b83813297a29b01cb7e36c47657e",
    "control_count": 22
  },
  "policy": {
    "path": "/home/runner/work/ai-governance-readiness-workbench/ai-governance-readiness-workbench/repo/policy/ai-lifecycle.yaml",
    "version": "1.0.0",
    "sha256": "b37d9916d9eb52558a731ce15c52b134ec4d466f6948a3335da22d45cf2522b0"
  },
  "results": [
    {
      "control_id": "DISC-01",
      "domain": "discovery",
      "assertion": "No file matching secrets patterns (.env, *secret*) exists in the scanned folder",
      "framework_refs": [
        "MAS-TRM-11.2",
        "ISO27001-A.8.24"
      ],
      "play_refs": [
        "P9.3",
        "P4.2"
      ],
      "policy_refs": [],
      "severity": "critical",
      "machine_verdict": "FAIL",
      "detail": "2 records found (max 0)",
      "findings": [
        {
          "path": ".streamlit/secrets.toml.example",
          "kind": "secrets",
          "hint": "Secrets-related file \u2014 verify it is a reference, not plaintext credentials",
          "controls": [
            "S1.3",
            "D2.2"
          ],
          "sha256": "a7145b6e4facacd96d90f1d2f60829d4f9a5fca7889d061e0e5e91845f38dd57"
        },
        {
          "path": "sample_evidence/infra/.env",
          "kind": "secrets",
          "hint": "Environment file \u2014 secrets may be stored in plaintext; must not be in evidence or repos",
          "controls": [
            "S1.3",
            "D2.2"
          ],
          "sha256": "7169412703c3edbf2de7c2dcd1fb1476dea91d7c951621eb2e3b79c06a3d174e"
        }
      ],
      "evidence": [
        {
          "source": "environment_scan",
          "ref": "/home/runner/work/ai-governance-readiness-workbench/ai-governance-readiness-workbench/repo/requirements.txt",
          "sha256": "37d903265c975af8a94873ea613aa5b58c82a25c0e7b54d4d9d4a4640f805376"
        },
        {
          "source": "environment_scan",
          "ref": "/home/runner/work/ai-governance-readiness-workbench/ai-governance-readiness-workbench/repo/test_assessor.py",
          "sha256": "bd1a9f72264abb179860759b888ddb461b58b69ea3eb18f49f4849d4280140e8"
        },
        {
          "source": "environment_scan",
          "ref": "/home/runner/work/ai-governance-readiness-workbench/ai-governance-readiness-workbench/repo/MODEL_CARD.md",
          "sha256": "0dbd2d5b75a498fc71ec5571ac17e0f245c055d73ef0276b4d83a35b7dcccd29"
        },
        {
          "source": "environment_scan",
          "ref": "/home/runner/work/ai-governance-readiness-workbench/ai-governance-readiness-workbench/repo/.streamlit/secrets.toml.example",
          "sha256": "a7145b6e4facacd96d90f1d2f60829d4f9a5fca7889d061e0e5e91845f38dd57"
        },
        {
          "source": "environment_scan",
          "ref": "/home/runner/work/ai-governance-readiness-workbench/ai-governance-readiness-workbench/repo/tests/test_step8.py",
          "sha256": "76d85e1a568865e075e714bd10b2d9f0c8faf91dd4428a84b4a2ce03d0c62d47"
        },
        {
          "source": "environment_scan",
          "ref": "/home/runner/work/ai-governance-readiness-workbench/ai-governance-readiness-workbench/repo/governance/eval_results.json",
          "sha256": "af088e020f18fcb9decaba77659921e58b7182524cc0813b6cc4a46eb4944828"
        },
        {
          "source": "environment_scan",
          "ref": "/home/runner/work/ai-governance-readiness-workbench/ai-governance-readiness-workbench/repo/schemas/inventory.schema.json",
          "sha256": "dc158723bcfd9c4cae21c2e226b3c6ad78a76955e95cfc7ba6507649d25e1314"
        },
        {
          "source": "environment_scan",
          "ref": "/home/runner/work/ai-governance-readiness-workbench/ai-governance-readiness-workbench/repo/sample_evidence/records/AI_inventory_extract_Aug2026.docx",
          "sha256": "dfc9c464135fc9eb2f740bd3f3eed32cd8b9b575b5c0231cbcec0b7de05e93c3"
        },
        {
          "source": "environment_scan",
          "ref": "/home/runner/work/ai-governance-readiness-workbench/ai-governance-readiness-workbench/repo/sample_evidence/infra/agent_logging_config.yaml",
          "sha256": "a0efd40090a9753473d07bcc1b93dfbb611de06a0d4d1629eb28ca76635c96db"
        },
        {
          "source": "environment_scan",
          "ref": "/home/runner/work/ai-governance-readiness-workbench/ai-governance-readiness-workbench/repo/sample_evidence/infra/.env",
          "sha256": "7169412703c3edbf2de7c2dcd1fb1476dea91d7c951621eb2e3b79c06a3d174e"
        },
        {
          "source": "environment_scan",
          "ref": "/home/runner/work/ai-governance-readiness-workbench/ai-governance-readiness-workbench/repo/stress/hotspots/h03_agent_promptfoo.py",
          "sha256": "9f2ed7651c007a6577c8c760ebd80085e4364bce1038d9269ac55fe01f5b82ec"
        },
        {
          "source": "environment_scan",
          "ref": "/home/runner/work/ai-governance-readiness-workbench/ai-governance-readiness-workbench/repo/stress/corpora/h03_promptfoo.yaml",
          "sha256": "cc4c95c9c7e256ed89dffda33f82604312403499992eb2e5ca4e81059ce8f67f"
        }
      ],
      "human_gate": "Reviewer confirms whether flagged files are references or actual credentials.",
      "human_verdict": null
    },
    {
      "control_id": "GOV-01",
      "domain": "policy",
      "assertion": "Every configured and deployed inference provider is in the policy's allowed_providers, or has an open exception",
      "framework_refs": [
        "MAS-TRM-11.1",
        "ISO42001-A.10.2",
        "MGF-D2.1"
      ],
      "play_refs": [
        "P7.1",
        "P4.3"
      ],
      "policy_refs": [
        "inference.residency",
        "inference.provider_exceptions"
      ],
      "severity": "critical",
      "machine_verdict": "NOT_TESTABLE",
      "detail": "Required source(s) missing or empty: runtime_config, policy_providers",
      "findings": [],
      "evidence": [],
      "human_gate": "Reviewer confirms no evidence left the machine during any period a non-local provider was configured.",
      "human_verdict": null
    },
    {
      "control_id": "MCM-05",
      "domain": "model-change-management",
      "assertion": "Approver on the change ticket is not the author of the code or prompt change",
      "framework_refs": [
        "MAS-TRM-6.1",
        "ISO27001-A.5.3"
      ],
      "play_refs": [
        "P3.4"
      ],
      "policy_refs": [
        "segregation_of_duties.approver_not_author"
      ],
      "severity": "critical",
      "machine_verdict": "PASS",
      "detail": "18 pairs, no identity overlap",
      "findings": [],
      "evidence": [
        {
          "source": "ticket_export",
          "ref": "/home/runner/work/ai-governance-readiness-workbench/ai-governance-readiness-workbench/repo/governance/tickets.csv",
          "sha256": "4ccee7e0d66f9bb767ea3b8760ca0c0e0c72f5eb2c3d3d51043ff6ebe34dcf2a"
        },
        {
          "source": "git_log",
          "ref": "git log -n500 @ /home/runner/work/ai-governance-readiness-workbench/ai-governance-readiness-workbench/repo",
          "sha256": "3a3ec8414e09a14774192f903534c994bfb2324b9fe44637fe16c238af0ecc7a"
        }
      ],
      "human_gate": "None if clean. Any overlap is escalated, not waived.",
      "human_verdict": null
    },
    {
      "control_id": "MCM-06",
      "domain": "model-change-management",
      "assertion": "Every commit touching prompt, guardrail or tool-permission paths references a change ticket",
      "framework_refs": [
        "MAS-TRM-6.1",
        "ISO42001-8.4"
      ],
      "play_refs": [
        "P4.1"
      ],
      "policy_refs": [],
      "severity": "high",
      "machine_verdict": "PASS",
      "detail": "No records in scope after filter",
      "findings": [],
      "evidence": [
        {
          "source": "git_log",
          "ref": "git log -n500 @ /home/runner/work/ai-governance-readiness-workbench/ai-governance-readiness-workbench/repo",
          "sha256": "3a3ec8414e09a14774192f903534c994bfb2324b9fe44637fe16c238af0ecc7a"
        }
      ],
      "human_gate": "Reviewer confirms quarterly what counts as a material prompt change.",
      "human_verdict": null
    },
    {
      "control_id": "MCM-07",
      "domain": "model-change-management",
      "assertion": "All dependencies are pinned to exact versions",
      "framework_refs": [
        "MAS-TRM-6.4",
        "ISO42001-A.10.3"
      ],
      "play_refs": [
        "P7.3"
      ],
      "policy_refs": [
        "dependencies.pinned"
      ],
      "severity": "high",
      "machine_verdict": "PASS",
      "detail": "All 10 dependencies pinned",
      "findings": [],
      "evidence": [
        {
          "source": "lock_file",
          "ref": "/home/runner/work/ai-governance-readiness-workbench/ai-governance-readiness-workbench/repo/requirements.txt",
          "sha256": "37d903265c975af8a94873ea613aa5b58c82a25c0e7b54d4d9d4a4640f805376"
        }
      ],
      "human_gate": "Reviewer assesses vendor-side model updates that occur without a customer-side change.",
      "human_verdict": null
    }
  ],
  "bundle_sha256": "83326105f0d7492e147219f84de8ee8cc5f09caf10ba9bbe6e13654b63412fc2"
}